{
  "schema_version": "1.0.0",
  "state_type": "coherent_transition_threshold_state",
  "repository": "StegVerse-Labs/Site",
  "threshold_state": "SYNCHRONY_OBSERVED",
  "conditions": {
    "transition_cluster_declared": true,
    "coherence_reference_observed": true,
    "required_transitions_jointly_ready": false,
    "continuation_conditions_preserved": false,
    "coherence_reference_regenerated_or_maintained": true,
    "next_cycle_admissible": false,
    "evidence_reconstructable": true
  },
  "evidence_refs": [
    "docs/ECOSYSTEM_HEARTBEAT_ORCHESTRATION.md",
    "data/ecosystem-heartbeat-state.json",
    "scripts/check_ecosystem_heartbeat_orchestration.py",
    "data/site-orchestration-state.json"
  ],
  "non_manufacture_rule_satisfied": true,
  "notes": [
    "The transition-driven heartbeat and repository observer establish a synchronization layer.",
    "The recursive continuity threshold is not yet established because the active transition cluster is not jointly ready and the next cycle is not yet admissible.",
    "This is a machine-readable system posture, not a claim that StegVerse is alive or that a biological threshold has been crossed."
  ],
  "authority": {
    "execution": false,
    "activation": false,
    "publication": false,
    "scientific_claim": false,
    "biological_classification": false
  }
}
